{
  "$schema": "http://json-schema.org/draft-07/schema#",
  "title": "ClientProfile",
  "description": "Client configuration profile for export operations.\n\nDefines the client-side configuration including inbound interfaces,\nDNS settings, routing overrides, outbound exclusions, and additional \noptions for generating proxy client configurations.\n\nAttributes:\n    inbounds: List of inbound interface configurations.\n    dns_mode: DNS resolution mode (system, tunnel, off).\n    routing: Optional routing configuration overrides.\n    exclude_outbounds: List of outbound types to exclude from export.\n    extra: Additional profile parameters.",
  "generator": "sboxmgr-schema-generator",
  "version": "1.0.0",
  "$defs": {
    "InboundProfile": {
      "description": "Configuration profile for inbound proxy interfaces.\n\nDefines parameters for incoming proxy connections including type,\nbind address, port, and protocol-specific options. Includes security\nvalidations to ensure safe defaults.\n\nSecurity features:\n- Defaults to localhost binding (127.0.0.1)\n- Uses safe non-standard port defaults\n- Validates port ranges and bind addresses\n- Requires explicit confirmation for external binding\n\nAttributes:\n    type: Inbound type (socks, http, tun, tproxy, ssh, dns, etc.).\n    listen: Bind address (defaults to 127.0.0.1 for security).\n    port: Port number (defaults to safe values per type).\n    options: Additional protocol-specific options.",
      "properties": {
        "type": {
          "enum": [
            "socks",
            "http",
            "tun",
            "tproxy",
            "ssh",
            "dns",
            "reality-inbound",
            "shadowtls"
          ],
          "title": "Type",
          "type": "string"
        },
        "listen": {
          "default": "127.0.0.1",
          "description": "Адрес для bind, по умолчанию localhost.",
          "title": "Listen",
          "type": "string"
        },
        "port": {
          "anyOf": [
            {
              "type": "integer"
            },
            {
              "type": "null"
            }
          ],
          "default": null,
          "description": "Порт, по умолчанию безопасный для типа.",
          "title": "Port"
        },
        "options": {
          "anyOf": [
            {
              "additionalProperties": true,
              "type": "object"
            },
            {
              "type": "null"
            }
          ],
          "description": "Дополнительные параметры.",
          "title": "Options"
        }
      },
      "required": [
        "type"
      ],
      "title": "InboundProfile",
      "type": "object"
    }
  },
  "properties": {
    "inbounds": {
      "description": "List of inbound configurations.",
      "items": {
        "$ref": "#/$defs/InboundProfile"
      },
      "title": "Inbounds",
      "type": "array"
    },
    "dns_mode": {
      "anyOf": [
        {
          "type": "string"
        },
        {
          "type": "null"
        }
      ],
      "default": "system",
      "description": "DNS resolution mode.",
      "title": "Dns Mode"
    },
    "routing": {
      "anyOf": [
        {
          "additionalProperties": true,
          "type": "object"
        },
        {
          "type": "null"
        }
      ],
      "description": "Routing configuration overrides.",
      "title": "Routing"
    },
    "exclude_outbounds": {
      "anyOf": [
        {
          "items": {
            "type": "string"
          },
          "type": "array"
        },
        {
          "type": "null"
        }
      ],
      "description": "List of outbound types to exclude.",
      "title": "Exclude Outbounds"
    },
    "extra": {
      "anyOf": [
        {
          "additionalProperties": true,
          "type": "object"
        },
        {
          "type": "null"
        }
      ],
      "description": "Additional profile parameters.",
      "title": "Extra"
    }
  },
  "type": "object"
}
